<?xml version="1.0" encoding="UTF-8"?>
<!ELEMENT libreria (libro+)>
<!ELEMENT libro (titulo, autor+, ISBN, paginas, precio)>
<!ELEMENT titulo (#PCDATA)>
<!ELEMENT autor (#PCDATA)>
<!ELEMENT ISBN (#PCDATA)>
<!ELEMENT paginas (#PCDATA)>
<!ELEMENT precio (#PCDATA)>
